[
  {
    "id": "REV-0001",
    "type": "review",
    "status": "removed",
    "severity": "low",
    "rule_id": "EXAMPLE_RULE",
    "scope": "example/*",
    "introduced_on": "2026-04-15",
    "expiry": "2026-04-30",
    "owner": "engineering",
    "approver": "tech-lead",
    "rationale": "Placeholder example - remove when real suppressions are added",
    "issue_link": "N/A",
    "last_reviewed": "2026-04-15",
    "lane": "architecture",
    "remediation_plan": "Remove before strict mode enforcement"
  }
]